{
  "$schema": "http://json-schema.org/draft-07/schema#",
  "$id": "https://cvjson.com/schema/v1.json",
  "title": "cv.json — Open CV Standard v1.2.1",
  "description": "An open, machine-readable standard for career data. Created by FreeCV.org for the AI era. v1.2.1 is a backward-compatible patch: it formally documents the x-customSections vendor extension already emitted in production and confirms x- vendor extensions are standards-valid (additionalProperties is true at the root).",
  "type": "object",
  "additionalProperties": true,
  "required": ["basics", "meta"],
  "properties": {
    "$schema": {
      "type": "string",
      "description": "Link to the cv.json schema version for validation",
      "format": "uri"
    },
    "basics": {
      "type": "object",
      "required": ["name"],
      "properties": {
        "name": { "type": "string", "minLength": 1, "description": "Full name of the person" },
        "label": { "type": "string", "description": "Job title or professional headline, e.g. 'Senior Product Manager'" },
        "email": { "type": "string", "format": "email", "description": "Email address (only included if user opted in)" },
        "phone": { "type": "string", "description": "Phone number in any format" },
        "image": { "type": "string", "format": "uri", "description": "URL to profile photo (JPEG or PNG)" },
        "summary": { "type": "string", "description": "Professional summary or bio (2-4 sentences)" },
        "location": { "type": "string", "description": "Location, e.g. 'San Francisco, CA' or 'London, UK'" },
        "url": { "type": "string", "format": "uri", "description": "Personal website URL" },
        "profiles": {
          "type": "array",
          "description": "Social and professional network profiles",
          "items": {
            "type": "object",
            "required": ["network", "url"],
            "properties": {
              "network": { "type": "string", "description": "e.g. LinkedIn, GitHub, Twitter" },
              "username": { "type": "string", "description": "Username on the network" },
              "url": { "type": "string", "format": "uri", "description": "Full profile URL" }
            }
          }
        }
      }
    },
    "work": {
      "type": "array",
      "description": "Work experience entries, ordered most recent first",
      "items": {
        "type": "object",
        "required": ["company", "position"],
        "properties": {
          "company": { "type": "string", "description": "Company or organization name" },
          "position": { "type": "string", "description": "Job title at the company" },
          "location": { "type": "string", "description": "Office location" },
          "startDate": {
            "type": "string",
            "pattern": "^[0-9]{4}(-[0-9]{2}(-[0-9]{2})?)?$",
            "description": "Start date (YYYY, YYYY-MM, or YYYY-MM-DD)"
          },
          "endDate": {
            "type": "string",
            "pattern": "^[0-9]{4}(-[0-9]{2}(-[0-9]{2})?)?$",
            "description": "End date (YYYY, YYYY-MM, or YYYY-MM-DD). Omitted if current."
          },
          "current": { "type": "boolean", "description": "true if this is the current position" },
          "summary": { "type": "string", "description": "Overview of responsibilities" },
          "highlights": {
            "type": "array",
            "description": "Key accomplishments and achievements",
            "items": { "type": "string" }
          }
        }
      }
    },
    "education": {
      "type": "array",
      "description": "Education history",
      "items": {
        "type": "object",
        "required": ["institution", "degree"],
        "properties": {
          "institution": { "type": "string", "description": "School or university name" },
          "degree": { "type": "string", "description": "Type of degree, e.g. 'Bachelor of Science'" },
          "field": { "type": "string", "description": "Field of study, e.g. 'Computer Science'" },
          "startDate": {
            "type": "string",
            "pattern": "^[0-9]{4}(-[0-9]{2}(-[0-9]{2})?)?$"
          },
          "endDate": {
            "type": "string",
            "pattern": "^[0-9]{4}(-[0-9]{2}(-[0-9]{2})?)?$"
          },
          "current": { "type": "boolean", "description": "True if studies are ongoing — omit endDate when set." },
          "score": { "type": "string", "description": "GPA or grade, e.g. '3.9/4.0'" },
          "summary": { "type": "string", "description": "Description of studies or thesis" },
          "highlights": {
            "type": "array",
            "description": "Notable coursework, achievements, or honors",
            "items": { "type": "string" }
          }
        }
      }
    },
    "skills": {
      "type": "array",
      "description": "Professional skills as a flat list of names",
      "uniqueItems": true,
      "items": { "type": "string" }
    },
    "languages": {
      "type": "array",
      "description": "Spoken languages and fluency levels",
      "items": {
        "type": "object",
        "required": ["language"],
        "properties": {
          "language": { "type": "string", "description": "Language name, e.g. 'English'" },
          "fluency": { "type": "string", "description": "Proficiency level: Native, Fluent, Advanced, Intermediate, Basic" }
        }
      }
    },
    "projects": {
      "type": "array",
      "description": "Notable projects",
      "items": {
        "type": "object",
        "required": ["name"],
        "properties": {
          "name": { "type": "string" },
          "description": { "type": "string" },
          "role": { "type": "string", "description": "Role on the project, e.g. 'Lead Developer', 'Contributor'" },
          "url": { "type": "string", "format": "uri" },
          "keywords": {
            "type": "array",
            "description": "Technologies or tags",
            "items": { "type": "string" }
          },
          "highlights": {
            "type": "array",
            "description": "Key accomplishments on the project",
            "items": { "type": "string" }
          },
          "current": { "type": "boolean", "description": "true if this is an ongoing project" },
          "startDate": {
            "type": "string",
            "pattern": "^[0-9]{4}(-[0-9]{2}(-[0-9]{2})?)?$"
          },
          "endDate": {
            "type": "string",
            "pattern": "^[0-9]{4}(-[0-9]{2}(-[0-9]{2})?)?$"
          }
        }
      }
    },
    "certificates": {
      "type": "array",
      "description": "Professional certifications",
      "items": {
        "type": "object",
        "required": ["name"],
        "properties": {
          "name": { "type": "string", "description": "Certificate name" },
          "issuer": { "type": "string", "description": "Issuing organization" },
          "date": {
            "type": "string",
            "pattern": "^[0-9]{4}(-[0-9]{2}(-[0-9]{2})?)?$",
            "description": "Date issued (YYYY, YYYY-MM, or YYYY-MM-DD)"
          },
          "url": { "type": "string", "format": "uri", "description": "Verification URL" }
        }
      }
    },
    "publications": {
      "type": "array",
      "description": "Published works — papers, articles, books, blog posts",
      "items": {
        "type": "object",
        "required": ["name"],
        "properties": {
          "name": { "type": "string", "description": "Title of the publication" },
          "publisher": { "type": "string", "description": "Publisher or journal name" },
          "releaseDate": {
            "type": "string",
            "pattern": "^[0-9]{4}(-[0-9]{2}(-[0-9]{2})?)?$",
            "description": "Publication date"
          },
          "url": { "type": "string", "format": "uri", "description": "Link to the publication" },
          "summary": { "type": "string", "description": "Short description or abstract" }
        }
      }
    },
    "awards": {
      "type": "array",
      "description": "Awards, honors, and recognitions",
      "items": {
        "type": "object",
        "required": ["title"],
        "properties": {
          "title": { "type": "string", "description": "Name of the award" },
          "date": {
            "type": "string",
            "pattern": "^[0-9]{4}(-[0-9]{2}(-[0-9]{2})?)?$",
            "description": "Date received"
          },
          "awarder": { "type": "string", "description": "Organization or entity that granted the award" },
          "summary": { "type": "string", "description": "Reason or context for the award" }
        }
      }
    },
    "interests": {
      "type": "array",
      "description": "Personal interests and hobbies",
      "items": { "type": "string" }
    },
    "volunteer": {
      "type": "array",
      "description": "Volunteer experience",
      "items": {
        "type": "object",
        "required": ["organization"],
        "properties": {
          "organization": { "type": "string" },
          "position": { "type": "string" },
          "url": { "type": "string", "format": "uri", "description": "Organization website" },
          "summary": { "type": "string", "description": "Overview of volunteer responsibilities" },
          "startDate": {
            "type": "string",
            "pattern": "^[0-9]{4}(-[0-9]{2}(-[0-9]{2})?)?$"
          },
          "endDate": {
            "type": "string",
            "pattern": "^[0-9]{4}(-[0-9]{2}(-[0-9]{2})?)?$"
          },
          "current": { "type": "boolean", "description": "True if this role is ongoing — omit endDate when set." },
          "highlights": {
            "type": "array",
            "items": { "type": "string" }
          }
        }
      }
    },
    "references": {
      "type": "array",
      "description": "Professional references — only rendered when referencesMode is 'show'. Kept in-document even when hidden so users don't re-enter them when they change visibility.",
      "items": {
        "type": "object",
        "required": ["name"],
        "properties": {
          "name": { "type": "string", "description": "Referee's full name" },
          "title": { "type": "string", "description": "Referee's current job title" },
          "company": { "type": "string", "description": "Referee's current company or organization" },
          "relationship": { "type": "string", "description": "How the referee knows the candidate, e.g. 'Former Manager', 'PhD Advisor', 'Colleague'" },
          "email": { "type": "string", "format": "email", "description": "Referee's email (share cautiously — candidates should have permission to list)" },
          "phone": { "type": "string", "description": "Referee's phone number" }
        }
      }
    },
    "referencesMode": {
      "type": "string",
      "enum": ["show", "on-request", "hide"],
      "description": "Controls how references render in output. 'show' = list full details. 'on-request' = render a localized 'References available upon request' footer instead of the list. 'hide' = render nothing. Default: 'hide'.",
      "default": "hide"
    },
    "availability": {
      "type": "object",
      "description": "Job-seeking status — machine-readable 'Open to Work'",
      "properties": {
        "status": {
          "type": "string",
          "enum": ["actively-looking", "open", "not-looking"],
          "description": "Current job-seeking status"
        },
        "roles": {
          "type": "array",
          "description": "Preferred job titles or roles",
          "items": { "type": "string" }
        },
        "locations": {
          "type": "array",
          "description": "Preferred work locations",
          "items": { "type": "string" }
        },
        "workType": {
          "type": "array",
          "description": "Work arrangement preferences",
          "items": {
            "type": "string",
            "enum": ["remote", "hybrid", "onsite"]
          }
        },
        "employmentType": {
          "type": "array",
          "description": "Employment type preferences",
          "items": {
            "type": "string",
            "enum": ["full-time", "part-time", "contract", "freelance", "internship", "temporary", "seasonal"]
          }
        },
        "startDate": {
          "type": "string",
          "pattern": "^[0-9]{4}(-[0-9]{2}(-[0-9]{2})?)?$",
          "description": "Earliest available start date"
        },
        "sponsorship": { "type": "boolean", "description": "Whether visa sponsorship is needed" }
      }
    },
    "ats": {
      "type": "object",
      "description": "Pre-parsed ATS metadata — auto-generated by the serving platform. Consumers should treat these as hints, not authoritative values.",
      "properties": {
        "keywords": {
          "type": "array",
          "description": "Extracted keywords from skills, job titles, and experience",
          "items": { "type": "string" }
        },
        "yearsOfExperience": { "type": "integer", "minimum": 0, "description": "Total years of professional experience" },
        "highestEducation": { "type": "string", "description": "Highest education level achieved" },
        "seniority": {
          "type": "string",
          "enum": ["entry", "junior", "mid", "senior", "lead", "executive"],
          "description": "Inferred seniority level based on experience"
        }
      }
    },
    "x-customSections": {
      "type": "array",
      "description": "Vendor extension (x- prefix) for USER-DEFINED sections that do not map to a standard top-level array (e.g. 'Speaking Engagements', 'Patents', 'Certifying Bodies'). The 'x-' prefix marks it as a non-standard annotation: a consumer that does not understand it MUST ignore it and never reject the document. Producers SHOULD fold standard-named sections into their canonical arrays instead (Awards -> awards, Volunteering -> volunteer, Publications -> publications, Interests/Hobbies -> interests), so only genuinely novel sections land here. Already emitted in production by FreeCV; documented formally in v1.2.1.",
      "items": {
        "type": "object",
        "required": ["name", "items"],
        "properties": {
          "name": { "type": "string", "description": "The user-defined section heading exactly as it appears on the CV, e.g. 'Speaking Engagements'" },
          "items": {
            "type": "array",
            "description": "Entries within the custom section",
            "items": {
              "type": "object",
              "properties": {
                "name": { "type": "string", "description": "Entry title / primary line" },
                "summary": { "type": "string", "description": "Free-text detail: the entry's subtitle, date range, and/or description blended into one line" },
                "highlights": { "type": "array", "items": { "type": "string" }, "description": "Bullet highlights for the entry" },
                "date": { "type": "string", "description": "Start/issue date as a free-form string (e.g. '2024' or 'Jun 2024'); custom entries are not date-pattern constrained" },
                "endDate": { "type": "string", "description": "End date as a free-form string, for ranged entries" },
                "url": { "type": "string", "format": "uri", "description": "Link if provided" }
              }
            }
          }
        }
      }
    },
    "i18n": {
      "type": "object",
      "description": "Internationalization metadata",
      "properties": {
        "primary": { "type": "string", "pattern": "^[a-z]{2}(-[A-Z]{2})?$", "description": "Primary language code (ISO 639-1), e.g. 'en' or 'en-US'" },
        "available": {
          "type": "object",
          "description": "Map of language code → URL pointing to a valid cv.json file translated into that language",
          "additionalProperties": { "type": "string", "format": "uri" }
        }
      }
    },
    "verification": {
      "type": "object",
      "description": "Trust and verification signals",
      "properties": {
        "email": { "type": "boolean", "description": "Whether email has been verified" },
        "platform": { "type": "string", "description": "Platform that generated this cv.json" }
      }
    },
    "meta": {
      "type": "object",
      "required": ["version", "canonical", "lastModified"],
      "description": "Schema version, canonical URL, and tooling metadata",
      "properties": {
        "version": { "type": "string", "pattern": "^[0-9]+\\.[0-9]+(\\.[0-9]+)?$", "description": "Schema version this document conforms to, e.g. '1.2.1'" },
        "canonical": { "type": "string", "format": "uri", "description": "Canonical URL for this cv.json — always returns the latest version" },
        "lastModified": { "type": "string", "pattern": "^[0-9]{4}-[0-9]{2}-[0-9]{2}", "description": "ISO 8601 date or datetime of last CV update, e.g. '2026-04-12' or '2026-04-12T09:00:00Z'" },
        "generator": { "type": "string", "description": "Tool or platform that generated this file" }
      }
    }
  }
}
