{
  "$schema": "https://cvjson.com/schema/v1.json",
  "basics": {
    "name": "Yara Haddad",
    "label": "Senior Backend Engineer",
    "email": "yara@example.com",
    "location": "Berlin, Germany",
    "url": "https://yarahaddad.dev",
    "summary": "Backend engineer with 6 years of experience building distributed systems in Go and Rust. Currently focused on observability and platform reliability.",
    "profiles": [
      { "network": "GitHub", "username": "yarahaddad", "url": "https://github.com/yarahaddad" },
      { "network": "LinkedIn", "username": "yarahaddad", "url": "https://www.linkedin.com/in/yarahaddad" }
    ]
  },
  "work": [
    {
      "company": "Streamline",
      "position": "Senior Backend Engineer",
      "location": "Berlin",
      "startDate": "2023-08",
      "current": true,
      "summary": "Lead backend on the platform reliability team.",
      "highlights": [
        "Migrated the request-routing layer from REST to gRPC, cutting p99 latency from 340ms to 95ms.",
        "Designed an event-sourced billing reconciliation pipeline processing 12M events/day.",
        "Mentored 3 engineers through promotion to senior level."
      ]
    },
    {
      "company": "Datacore",
      "position": "Backend Engineer",
      "location": "Munich",
      "startDate": "2020-09",
      "endDate": "2023-07",
      "current": false,
      "highlights": [
        "Built the multi-tenant query engine that powers the analytics product, in Go.",
        "Owned the on-call rotation for the data plane (8 engineers, 24/7)."
      ]
    },
    {
      "company": "Kifa Labs",
      "position": "Junior Software Engineer",
      "startDate": "2019-06",
      "endDate": "2020-08",
      "current": false,
      "highlights": [
        "Shipped the first version of the developer SDK in TypeScript."
      ]
    }
  ],
  "education": [
    {
      "institution": "TU Munich",
      "degree": "BSc Computer Science",
      "field": "Software Systems",
      "startDate": "2016",
      "endDate": "2019"
    }
  ],
  "skills": [
    "Go", "Rust", "TypeScript", "PostgreSQL", "gRPC", "Kubernetes",
    "Distributed Systems", "Observability", "Event Sourcing"
  ],
  "languages": [
    { "language": "English", "fluency": "Native or bilingual" },
    { "language": "Arabic", "fluency": "Native or bilingual" },
    { "language": "German", "fluency": "Professional working" }
  ],
  "meta": {
    "version": "1.3",
    "canonical": "https://livelink.cv/yara-haddad",
    "lastModified": "2026-06-01",
    "generator": "FreeCV"
  }
}
